user_id,tweets,status
0,the real reason why you be sad you be attach to people who have be distant with you you be pay attention to people who ignore you you make time for people who be too busy for you you be too care to people who be care less when it come to you let those people go;my biggest problem be overthinking everything;the worst sadness be the sadness you have teach yourself to hide;i cannot make you understand i cannot make anyone understand what be happen inside me i cannot even explain it to myself;i do not think anyone really understand how tire it be to act okay and always be the strong one when in reality you be close to the edge;the worst feel be when something be kill you inside and you have to act like you do not care;when i be hurt i shut down i turn into a total bitch i shut off my emotions i act differently towards everything and everyone and i hate it;overthinking ruin you ruin the situation twist things around make you worry and just make everything much worse than it actually be;i be disappoint in myself because i know i be better than the choices i keep make and the things i choose to deal with;i be just so tire of this my body be tire my mind be a mess i just really want to lay in bed and never get up i be just so tire of life;be you okay me no but it be okay;i be sick of make things worse i be sick of be hurt i be sick of cry myself to sleep i be sick of hat everything i be sick of fake a smile i be sick of feel this way i be sick of let people down i be sick of be me;live with depression and anxiety no motivation to leave your bed dread leave your house not be able to go out unable to make new friends be paranoid or restless mentally hurt zone out a lot ignore people not be yourself;sorry for be so fuck up sorry for be such a failure sorry for be a disgrace sorry for be me;do you ever write a really long message and about halfway through you be like you know what they do not even care and end up delete it,Depression
1,i be tire go to sleep then no you do not understand;you hide when you cry because you want to be see as a strong person at the same time though you hate how nobody notice how break you be;please do not expect me to always be good and kind and love there be time when i will be cold and thoughtless and really hard to understand;i do not think people really understand just how stressful it be to explain what be on your mind when you do not even understand it yourself;i be scar to get close to people because i think they will eventually walk out of my life no matter how close we be because everyone leave;i think i be afraid to be happy because whenever i get too happy something bad always happen;i hate get so sad to the point where my body completely shut down and all i can do be just lay there and think about all my problems;i already know i be not good enough;sleep be so hard when you cannot stop think;i be not the same anymore i will admit it a lot of shit get to me;social anxiety suck you unintentionally make yourself sad you feel alone even when you be not and sometimes you do not even know what be wrong;i say sorry a lot because i secretly feel that everything be my fault;it suck do not it feel like you be not good enough no matter how hard you try;depression be not always sadness it can also be emptiness anger tiredness or loneliness sometimes a cry for help be not so visible;do you ever feel physically sick because you know you be not good enough for anyone and cannot do anything right no matter how hard you try,Depression
2,i wish someone be afraid to lose me i be always scar of lose people that i love but i doubt anyone would fight to keep me in their life;i be just so tire of this my body be tire my mind be a mess i just really want to lay in bed and never get up i be just so tire of life;sometimes i be disappoint in myself because i know i be better than the choices i make and the things i choose to deal with;you can only be so strong for so long until you reach a point where you break physically mentally emotional;my biggest mistake ever be think that people care for me as much as i do for them but in reality it be almost always one side;i do not tweet for sympathy or attention i express my thoughts and feel this be my outlet where i can say stuff without feel judge;when i die do not go to my grave and sit there tell me how much you love and miss me those be the things i need to hear when i be alive;i truly feel like everything i say or do be always wrong like i be a total disappointment to everyone and all i ever do be let people down;i overthink a lot i be sensitive and clingy but i really do try my hardest to be good enough so i be sorry if that be not enough;do you ever just sit there and realize that you mean nothing to anyone and you start feel lose alone and unloved and truly unwanted;she pretend like nothing happen because she want people to see her strong only she know how painful emotionaly mentally she really be;be sad for no reason be worse than be sad for a reason because there be absolutely nothing you can do to make yourself feel better;i prefer to distance myself whenever i be mad because i turn into the most heartless person you will ever meet and you be go hate me for that;i be sorry for be annoy when i want to talk needy because i miss you emotional when i care and insecure because i be afraid to lose you;why be you sad i do not know no reason oh no there be plenty of reason i be just not really sure which one it be this time,Depression
3,do you ever feel ok but your sad at the same time you just want to talk to someone and hug them but you feel annoy so you just stay quiet;she might be laugh but deep inside she be hurt she be try to get her mind off things that make her upset by pretend to be fine;i literally notice the smallest of change in how people treat me and i overthink into think everyone hat me;you unintentionally make yourself sad you feel alone even when you be not and sometimes you do not even know what be wrong;people think you be rude or always in a bad mood;it be easier just to say i be fine when somebody ask if you be okay because sometimes it be not possible to explain why you be not;do you ever just make up scenarios in your head that you know will never happen but it make you so happy so you just keep on imagine them;oh ok actually mean my heart just get rip into a million piece but i will not tell you because you would not care how i feel anyway;i never really know where i stand in some people life one minute they treat me like i be something special then nothing the next;the worst feel be when you find out you do not mean as much to someone as you think you do and you look so stupid for care too much;every night i think about all the mistake i have make and how much i regret make those decisions because my life could have be different;the worst type of cry be at night when everyone be asleep and you have to control it with your hand over your mouth to not make a sound;sometimes it be better to keep silent than to tell others how you feel because it hurt know they can hear you but not understand you;i hate get flashbacks from things you do not want to remember it feel like your heart suddenly drop and anxiety start take you over;i be sorry i have trust issue but when you give someone everything and they toss it away like nothing something inside of you break,Depression
4,i need someone who will understand how unstable i be sometimes be alone can be dangerous for me but other time its exactly what i need;my only relief be to sleep when i be sleep i be not sad i be not angry i be not scar i be not hurt i be not lonely i be just nothing;i hate this feel like i be here but i be notlike someone care but they do not it be like i belong somewhere anywhere but here;have you ever want to cry but no tear come out so you just stare blankly into space while feel your heart break into a million piece;i feel myself change i do not laugh the same anymore i do not smile the same or talk the same i be just so tire and mentally exhaust;pain change people it make them trust less overthink more and shut people out;nothing hurt more then be ignore replace forget lie to;you think you be do okay and then suddenly it be a nighttime and you be alone and you be not really sure how to distract yourself anymore;all the things i do wrong 1 i rely on someone for my happiness 2 i love people more than i love myself 3 i never ask for help;we hide behind a fake smile to mask the pain but sometimes we wish someone would look closely enough and see how break we really be inside;type haha when you cannot even smile act like you be happy when all you want to do be cry tell everyone you be okay when you be not;do you ever feel the need to ask someone if they actually still want you in their life because it always feel like they do not really care;you smile but all you want be to cry you talk but you really just want to be quiet you pretend like you be happy but you really be not;that worthless feel where you should just lock yourself in a dark room because everything you do or say just seem to piss people off;she be scar to get to close to anyone anymore because everyone who promise her they would stay turn their back on her and walk away,Depression
5,have you ever be in one of those moods where you do not really know what be wrong but you feel really irritate with everyone and everything;i be scar to get close to people because i think they will eventually walk out of my life no matter how close we be because they always do;fghhhhjjjj;fgjj;she be hurt mentally and emotionally but everyday she walk with a smile because that be who she be the girl who never stop smile;when i be hurt i shut down i turn into a total bitch i shut off my emotions i act differently towards everything and everyone and i hate it;so many people in this world have trust issue because people say i be here for you and then run away as soon as things start to fall apart;just because her eye do not tear up do not mean her heart do not cry and just because she come off strong do not mean nothing be wrong;hate get flashbacks from things you do not want to remember it feel like your heart suddenly drop and anxiety start take over վou;when i cry about one thing i end up cry about everything that be mess up in my life;it really suck want to talk to someone but you really do not want to annoy anyone because they seem totally fine without you;everything be change and i do not know where i fit anymore;they say it will get better but its a lie it do not get better you just get use to it;it be painful to say goodbye to someone you do not want to let go but more painful to ask someone to stay when you know they want to leave;i hate the fact that i cry when i be angry and that be the worst thing ever because you be try to act tough and mean but instead you cry,Depression
6,every night i convince myself tomorrow will be different but it never be;my biggest problem be overthinking everything;you smile but you want to cry you talk but you just want to be quiet and you pretend that you be happy but you be not;i be the type of person that one thing can change my mood completely and i can go from confident to insecure in a matter of second;i be a paradox neither happy or sad i smile at pretty things amp laugh at funny things but at night i become a mess of emotions and thoughts;have you ever just randomly start cry because you have be hold in all of these emotions and pretend to be happy for way too long;it hurt so much when you can feel yourself become less and less important to the one person who truly mean the most to you;pain change people it make them trust less overthink more and shut people out;have you ever really want to ask a question but you do not because you know in your heart that you would not be able to handle the answer;you have change try go through what i have go through and then see if you be the same pain change people it make it harder to trust;physically mentally emotionally tire;its sad nobody ever know how much someone be actually hurt someone right next to you could be completely break and you would not know;you be so afraid to tell people how you feel because you fear rejection so you bury it deep inside yourself where it only destroy you more;my problem be that i start depend on people for my happiness and when they leave like they always do they take my happiness with them;how painful be it to say i be fine to the person who be the reason you be break,Depression
7,one minute everything be okay and the next i have no idea what be go on;the worst feel be feel unwanted by the person you need the most;it really hurt when someone be not in the mood to talk to you but when it come to someone else they act like the happiest person alive;it be scary that you never really know what someone be think or feel towards you and everything that they say could be one massive lie;all i ever want be for someone to not give up on me no matter how much i screw up and no matter how much i push them away they will stay;i be so sorry for all the people that have to deal with my constant up and down moods daily;how many time have you type i be okay while cry;it be easier just to say i be fine when somebody ask if you be okay because sometimes it be not possible to explain why you be not;i be sorry i cannot live up to your expectations i be sorry i cannot be normal like everyone else i be sorry i be not as good as everyone else;i cannot stand how quickly my mood change it effect my whole life because nobody understand me and people just get really annoy with me;do not come to my gravestone and display emotions which you never once show to me while i be breathe because that could have keep me alive;have you be so sad and tire and want to be alone but at the same time you really wish there be someone who you could talk to who care;i be the girl who pretend people word do not hurt me just so they do not know how sensitive i really be;have you ever want to cry but no tear come out so you just stare blankly into space while feel your heart break into a million piece;i do not really think people understand how stressful it be to explain what be go on in your head when you do not even understand yourself,Depression
8,it hurt like hell when you know that you need to let go of someone but you cannot because you be still wait for the impossible to happen;i hate get close to people these days i always regret share too much care too much do too much and feel too much;it be kind of sad when you realize the person you use to tell everything to now have no idea of what be happen with your life;i hate that feel when you be not necessarily sad but you just feel really empty;i have disappoint a lot of people this year but believe me when i say there be no one i have disappoint more than myself;my thoughts always destroy my mood;she be just break and probably cry herself to sleep almost every night although she tell you she be do fine and she be okay but she be not;it be unbelievable how fast people can change one day you mean everything the next day you do not exist anymore;when you be ignore by someone whose attention mean the most to you be the worst feel you start to over think and it eat away at you;i be just so tire tire of never be good enough tire of get put down tire of cry tire of insecurities tire of be tire;i really hate when i say things without think i always end up hat myself a little more each time know i might of upset someone;that feel when you can actually feel the pain in your chest from hear something or see something that really break your heart;i be literally so tire of be nice to people and go out of my way to make sure they be okay and happy just to be treat like shit;i hate when i cry about one thing then i end up cry about everything that be mess up in my life;you do not know pain until you be star at the mirror with tear stream down your face beg yourself to just hold on and be strong,Depression
9,it be sad that we can find thousands of people on twitter who understand and feel the same way we do but in everyday life we have no one;have you ever felt like you want to cry in the middle of the night without know which one of the reason it be that make you want cry;you cannot just break someone into a million piece and treat them like crap and then expect them to be okay just because you say i be sorry;i have always be afraid of lose people i love sometimes i wonder if there be anyone out there afraid to lose me;maybe i be better of alone because no one have ever love me the way i love them and i have never felt like anyone want me or need me at all;the worst type of cry be the silent one the one where you really have to hold your breath and grab your stomach just to keep quiet;she pretend like nothing happen because she want people to see how strong she be only she know how painful and emotional she really be;when i say i be okay i want someone to look me in the eye hug me tight and say i know you be not;when someone stop talk to me the way they use to i sit and stress myself think if everything else we share together be just a lie;every time i think about how stress i be i get even more stress so it be like a never end stress cycle i cannot seem to break free from;how be it possible that someone can hurt you repeatedly and you still care for them so much;you do not realize how lonely you be until it be the end of the day and you have a bunch of things to talk about but no one to tell them to;your twitter be one of those things that you want everyone to see but at the same time you never want to show it to anyone;that embarrass moment when you have to quickly wipe away your tear put a fake smile on because you hear someone come in to the room;do you ever have one of those days where nothing go wrong but you feel like you hate the world and you just feel like break down cry,Depression
10,when you have be sad for so long that when something bad happen you do not cry you just sit there and feel numb;depression be not always the girl cry in the bathroom or wear long sleeves sometimes it be the girl with the biggest smile on her face;those teenagers who sit in their room at night cry themselves to sleep be once children with light in their eye and hope in their heart;i be officially do try if you want me in your life you can come find me until then continue treat me like i do not exist;i get so sad i get insecure i get jealous i get lonelyi i overreact and i make mistake but ipromise i will always give you my loyalty;it hurt so much when you can feel yourself become less and less important to the one person who reay mean the most to you;it be funny how you think you be do fine but then one little thing remind you of the past and it all come back and slap you in the face;what happen we just stop talk;i be sorry i have trust issue but when you give someone everything and they just toss it away like nothing something inside of you break;i be a paradox neither happy or sad i smile at pretty things laugh at funny things but at night i become a mess of emotions and thoughts;i always overuse the word tire because i cannot find a better word to describe how i feel and that be literally the only thing i feel;when i die do not come to my grave amp sit there tellin me how much you love and miss me those be the things i need to hear when i be alive;when i be upset and i want to talk to someone about it i realise they probably would not care or know what to say so i keep it all inside;you be the person that will not ask for help would never tell your parent what be wrong but you be the one that need help the most i know;silence do not always mean yes sometimes it mean i be tire of explain to people who do not even care to understand,Depression
11,i really just need a day off from reality just a day without people problems and all the bullshit that constantly run through my mind;i always act like i be fine and everyone think i be okay but when the light be off and i be all alone that be when my tear start to fall;that sick feel when you can actually feel the pain in your chest from hear something or see something that really break your heart;i hate get flashbacks from things you do not want to remember it feel like your heart suddenly drop and anxiety start take over you;she be jealous because she care she accuse you because she be be hurt she ask the same question because she need reassurance she care;that feel when you can actually feel the pain in your chest from hear something or see something that just really break your heart;i need someone in my life who care about me as much as i care about them because i be so tire of always be the one who care more;have you ever just randomly start cry because you have be hold in all of these emotions and pretend to be happy for way too long;it really hurt when you care so much about someone and get so attach to them and one day they just turn around and leave like nothing;it suck do not it feel like you be not good enough no matter how hard you try;she hide all her problems behind a smile behind her smile be a world of pain and hurt you think you know her but you really have no idea;be sad for no reason be worse than be sad for a reason because there be absolutely nothing you can do to make yourself feel any better;i be so tire i be stress and i be sad everything hurt i be about to break down and i know i should be stronger than this but i be not;i prefer to distance myself whenever i be in a bad mood because i will become the most heartless person you will ever meet;do you ever just stay up all night long think about your mistake and regret for not say the things that you should have say i do,Depression
12,i be sorry for be annoy when i want to talk needy because i miss you emotional when i care and insecure because i be afraid to lose you;i have so much on my mind but i end up say nothing at all;the worst type of cry be the silent one the one where you have to hold your breath and grab your stomach to keep quiet;i be a really hard person to understand i have major issue with talk about all my feel and thoughts and i be really sorry i be try;do you ever just sit there and realize that you mean nothing to anyone and you start feel lose alone and unloved and truly unwanted;it hurt when you go through something that kill you inside but you have to act like it do not affect you at all;i be sorry i have trust issue but when you give someone everything and they toss it away like nothing something inside of you just break;have you ever be so sad that it physically hurt;i be truly sorry i get sad over nothing i be sorry i feel everything at once i be really sorry i be so screw up i be sorry i mess everything up;what if twitter tweet your thoughts without permission we would all be in the shit;i have disappoint a lot of people this year but trust me when i say there be no one i have disappoint more than myself;i have try so hard to make myself a better person but for some reason i be never enough;i be sorry that i be not everything you want and i be sorry that my best be not good enough i be sorry that everything i do disappoint you;depression be not always suicide note and pill bottle sometimes it be all smile and fake laughter depression be not always easy to notice;do you ever miss the person that you use to be before you get your heart break before you lose someone or before your family fell apart,Depression
13,why be you sad i do not know anymore;be ignore hurt like hell and it make me think i do something wrong then i start to over think everything;instead of tell you how i feel i sit on twitter and post tweet about it;oh sorry i forget i only exist when you need something;some people suddenly change one day you be important next day you be worthless;i destroy myself so you could not;overthinking always destroy my mood;i just do not want to bother people with my problems anymore and that be why i act like i be perfectly fine and keep it all to myself;i miss the feel of know i be actually important to someone;i seriously overthink everything which make me stress myself out and it create problems that be not even there in the first place;i be so tire of get lie to tire of be use tire of fake people tire of please people tire of judgmental people just tire;i like to pretend that everythings alright because when everybody else think you be fine sometimes you forget for a while that you be not;she be the girl who laugh smile and talk a lot and seem really happy she could also be the girl who cry herself to sleep every night;mentally and emotionally drain;no one notice your tear no one notice your sadness no one notice your pain but they all notice your mistake,Depression
