user_id,tweets,status
408,daily guide spiritual principles to live your best life awaken app new content now available;your bless have your name on them when you be ready an opportunity will come when it show up you will need to be ready;people act out of the need for heal but remember love will heal anything that be not an expression of love;new improve audio content update available mind matter meditations to soothe and heal the mind by iyanla vanzant;iyanla speak about be a spiritual warrior and just say yes she encourage us to say yes to challenge ourselves grow and learn take from iyanlas daily anti viral message day 49 originally air on may 9 2020;regardless of how much you want it or think you need something if it be not in the divine plan for you to have it you will not have it;when you cannot figure out how to make sense out of nonsense stop try just keep breathe sooner or later it will become clear;while most of us believe divine energy exist outside of us the truth of the matter be this energy be actually within us;life want you to be in good shape while you be here you be no good to life when you be haggard break and break down;without boundaries people may take advantage of you because you have not set limit about how you expect to be treat this spiritual spa we be go to talk about how to build better boundaries register now at;get daily powerful coach in iyanlas soothe voice with the new update awaken app;prayer be the most highly effective spiritual act one can perform prayer bring us into alignment with what already exist within us;tree rain forest minerals and animals be not the only natural resources worthy of conservation you be a divinely natural resource;iyanla offer an affirmation on renew your mind take from iyanlas daily anti viral message day 52 originally air on may 30 2020;every live be be accountable and responsible to their creator to treat others in the way they would want to be treat,Normal
409,we all need courage in order to be will to honor the divine in the face of our human challenge;if you appreciate what you do for others their response should be of little or no consequence to you;the divine only ask us to be will to do whatever be necessary to move into our own state of divinity;strong boundaries protect your selfesteem and your identity as an individual with the right to make your own choices that be why for this spiritual spa we be go to talk about how to build better boundaries register now at;subscribe today amp get all new daily principles wake up iyanlas voice alarm feature and more;remain ground in the knowledge of who you really be especially when life experience threaten to make you forget;no matter what you be experience fear not you cannot lose because god know what you need and help be already on the way;remain open there be something bigger than you know go on here;new improve audio content update available mind matter meditations to soothe and heal the mind by iyanla vanzant;what you be be challenge by may be the very thing you have be wait for;as a teacher i know the minute i stop learn i can no longer teach the minute i think i know it all i be do;in the midst of a difficult situation do not shut down open up remain open about be teach what to do next;you need mentor and people in your life to sustain you you be also responsible for offer support to those come behind you;live your best life with the new update awaken app;you must be discipline in think word and deed consciously train yourself to do those things that be good for you,Normal
410,iyanla read an excerpt about attention and love from how then shall we live write by wayne muller take from iyanlas daily anti viral message day 48 originally air on may 8 2020;be obedient to your mind when it speak to you listen to your thoughts because they be your higher call;when you withhold forgiveness or love from anyone the good that you withhold from others will be withhold from you;i know i be not alone on the journey to spiritual strength and personal joy you help me remember that truth;learn to relax and conserve your natural energies be one of the greatest gift you can offer life;i be grateful for the opportunity to share with others the challenge i have discover in be human;you do not always have to have something to do do not rush conserve some of your resources for yourself;daily guide spiritual principles to live your best life awaken app new content now available;spend a few moments listen to your thoughts repeat selfaffirming thoughts and weed out the negative chatter;in order to honor the divine we must show up stay alert and be will to learn the lessons we be give;prayer in its truest form have the power to shift circumstances to bring peace in hard time and to provide clarity in uncertainty start on june 13 join me for the 7day prayer challenge and recognizeand overcomethe barriers to effective prayer;among all the duties and responsibilities you must fulfill today take a few moments to do something for yourself;no matter who you be and what you think you know or do not know life will teach you to honor and respect balance there must be discord in order to achieve harmony there must be darkness that propel us into light;remember the more damage and destructive a person behave the greater be their cry for heal and correction;if you want to experience peace you must begin from a posture of peace caution be prepare to stay in that posture as long as it take,Normal
411,get daily powerful coach in iyanlas soothe voice with the new update awaken app;do not add think word or deed to a destructive situation stand there and pray call in the light of peace of love of the divine;if you want peace be peaceful;when we quiet the conscious mind we can hear the voice of god from within our be;whatever you say to yourself today let it be something good you must make a habit of begin each day by tell yourself nice things;the act of meditation be the best way to get plug in and turn on to the power of the divine;it be absolutely necessary to flood your mind with positive thoughts about yourself;thank you beloveds for 8 season of love support and so it be do stay in peace not piece deep bow of love and respect;without a doubt i have one of the best production team on the planet redd claybourne champ rodney breedlove sheka erica bryant clay quez trey monroe chuck sylvetta revcoach lt ashley montrey drd coach laura sir rodney scott and god deep bow to you;can i get a big up for my cohost the ms ttssues;so beloveds what be your favorite episode which one make the greatest impact on your life tonight you will learn about mine;subscribe today amp get all new daily principles wake up iyanlas voice alarm feature and more;be there break things you have not take the time to fix be there break things you have not take the time to get rid of if the things in your environment be a reflection of what go on in your mind ask yourself be my mind well order;today speak the truth hear the truth see the greater divine truth in every situation you encounter;join me in june for the 7day prayer challenge and learn the principles of prayer that allow your prayer request to manifest with grace and ease,Normal
412,reminisce on nearly 10 years of lifechanging fix during the farewell special tonight at 98c on;iyanlas anti viral mssage;by remind yourself daily that you be a perfect and unique representative of all that god be you will find that you be equip to handle anything;new improve audio content update available mind matter meditations to soothe and heal the mind by iyanla vanzant;right here right now all that be good all that be divine be at my disposal for this i be grateful;selfaffirming word and action be necessary to counteract the unpleasant things we have say about ourselves;i be thankful to for share the news of our celebration of nearly ten years of tomorrow with a farewell special on at 98c;i know there be only one life one power one mind one spirit of universal intelligence wisdom and judgment;your self be divine your self be powerful your self can never be alter this be the truth about yourself;live your best life with the new update awaken app;when things get a little rough it be always good to remember that you cannot stay where you be forever;you will never know the joy of love or the peaceful satisfaction of be love if you hide from hurt;it be hard to say good bye join me for the farewell special this saturday on at 98c;your character your nature the distinctive qualities of your essence what make you you be develop through experience;you cannot experience the fullness of your authentic self or life when you live to avoid hurt,Normal
413,do not miss this incredible opportunity to fix your life the fix your life weekend at the beautiful you will learn the skills and tool to open your mind and heart to the greatest possibilities for your life for more information;let go and open your heart to the possibility that there be something great wait for you;the quest for perfection be a waste of time and energy things be the way things need to be;when you be attach to the way things be it be difficult to put your faith in anything else you do not trust life to bring you what you need;stop try to be perfect stop it right now stop try to fix yourself change yourself perfect yourself;awaken app new content now available;you must develop the discipline to think right it be will give you the discipline to act right;take a moment to identify all the things that would fulfill your spirit then ask the angels to serve it up;iyanla read a poem for earth from spiritual literacy by frederic brussat and mary ann brussat take from iyanlas daily anti viral message day 47 originally air on may 7 2020;take one step towards do something you have be think about celebrate any progress you make;would you believe that there be many eager angels guardians and guide just wait to serve you;there be no one who do not make mistake if we do not make mistake we would not learn what work and what do not work;as a nurture source for life water be the most powerful heal natural element ever know to man;get daily powerful coach in iyanlas soothe voice with the new update awaken app;we can get so catch up in the process of life the responsibilities of life what we want from life that we forget to have fun fun give you a new outlook it help you expand your mind amp your spirit you need to go and have some fun go on find something fun to do and do it,Normal
414,god be therefore i be take from iyanlas daily anti viral message day 50 originally air on may 16 2020;we must inspire ourselves by believe we have the power to accomplish everything we set out to do;the holy spirit within and around you know everything you need to know and will let you know when you need to know;you be the only one who can do it like you do it when you put your mind to something you get it do so what be you wait for;your life be always talk to you listen to what life be say then commit to make the adjustments that be need;and so it be fix mylife be complete new fix my life episodes will be no more but all have have so many lessons i pray you keep watch it have be my honor to serve you do tune in next week to learn what have teach me;when we do not know what to do we will act like we do not know very often do not know be an exit strategy and a defense mechanism;i find it so interest that both and understand david jr perfectly perhaps because we be listen with our hearts not our ears that be a note to parent he have be silent for so long he be learn to speak out loud;i encourage you to get your son call your nephews and your grandsons sit them down to watch on let us keep our young men out of the pipeline and teach the father brothers uncles how to support them;this be my open letter all young black men who represent my father my son my grandsons and my greatgrandsons this be my open letter from a mother heart a grandmothers heart black men you matter;stupid be a disease and you can catch it that be real;brothers men father join for know dumb question every thursday even real talk about real stuff for men about men between men stream live on facebook instagram and twitter thursday 6 pm;brothers men father join for know dumb question every thursday even real talk about real stuff for men about men between men;the culture see young black men as be something harmful if you think the bee will hurt you you will attempt to destroy it first;i could not have ask for better support than,Normal
415,well beloveds 8 season 151 episodes tonight we end on a high note real talk thank you for tune in;come up next on iyanla fix my life;subscribe today amp get all new daily principles wake up iyanlas voice alarm feature and more;the game of life be rig in your favor the angels be play on your side;when you be in a conversation hear every word that be speak through the center of your heart;do not miss the final episode of tonight at 98c on;join us tonight for the last fix the twohour series finale of air at 98c on;iyanlas anti viral mssage;iyanlas anti viral mssage;the goal of life be not to win it be to play the game with love the rule of the game be have a strong desire to win believe that you be worthy of win have faith that you will win and as long as you be alive never believe that the game be over;we die of old beliefs to be reborn in truth we die to old ways of be to be reborn in our power;the very last fix join iyanla vanzant on one last journeythe twohour series finale of air this saturday at 98c on;new improve audio content update available mind matter meditations to soothe amp heal the mind by iyanla vanzant;there come a moment when you must decide that you be go to believe in yourself if you believe you have the power the power be yours;masterclass date have change to tuesday may 18th you be invite find the gift in these unpredictable time with lynne twist sara vetter and internationally recognize think leaders then click here to join the free master class,Normal
416,the stuff you be critical of in others be the same stuff you do not like about yourself;there be nothing more validate than belief in yourself and your abilities;criticism do not make you smarter or better than the one you be criticize;live your best life with the new update awaken app;be aware of how you think what you think you may not realize how unkind unsupportive or rough you can be with yourself;open yourself to guidance give up your attachment to have things your way open yourself to gods way;it be not easy to forgive it can even feel impossible but trust me beloved the weight that will be lift off your shoulder when you learn to forgive will be what set you free from the burden of carry your pain day in amp day out;be aware of how you handle your mind be aware of how you treat yourself;god cannot help you unless you allow god to help you;when we put the force of our inner self to work with good thoughts it will produce accord to our system of ideas;it be not what you hear it be where you listen from within yourself that give mean to the message;there be a dignity and nobility that be attain by those who can forgive that be why we be go to talk about forgiveness at this months spiritual spa which be happen on thursday may 13th at 5pm pt 8pm et reserve your spot;a belief be the most contagious influence you possess we fuel our world with our beliefs;when we affirm the very best of and for our children they have a very different view of their place and position in the world do not call them anything you do not want them to be speak seed of greatness in their mind and they will grow into strong sturdy plant;new update awaken app free to download,Normal
417,when your joy be dependent on people and condition it be restrict;if you be afraid to take a chance take one anyway what you do not do can create the same regret as the mistake you make;new improve audio content update available mind matter meditations to soothe and heal the mind by iyanla vanzant;iyanla read the invitation by oriah mountain dreamer say that this poem be something that help her learn how to live take from iyanlas daily anti viral message day 46 originally air on may 6 2020;depend on anyone to make you happy make you feel good or lift your spirit be a sure way to place yourself in isolation;you can and do change with every new experience you be grow and learn every moment of every day;you be invite four opportunities to attend a free master class find the gift in these unpredictable time with lynne twist sara vetter and internationally recognize think leaders join us for one or all of the free master class;at this months spiritual spa we be go to come together and talk about forgiveness so that you can learn how to recognize the areas of life that need forgiveness move away from the role of the perpetual victim and release yourself to register;truth be a spiritual principle that if embrace wholeheartedly will eliminate the dark negative thoughts we have;it be in our best interest to give everyone a fair share regardless of what we have hear about them;get daily powerful coach in iyanlas soothe voice with the new update awaken app;when someone entrust their heart to you they be give you a piece of their soul you cannot treat the soul casually you must protect nurture and handle it with care;every relationship family friendship love and marriage be about growth and development we come together to share learn and grow;iyanla offer a simple affirmation about choose truth and extend freedom take from iyanlas daily anti viral message day 49 originally air on may 9 2020;the biggest obstacle we must overcome on the spiritual path be our own mind,Normal
418,a mistake or bad decision do not mean there be something wrong with you we make mistake because we be human;there be many paths that lead to one road no one can give you faith and no one can choose for you what to believe;beloveds do not be afraid to admit when you be wrong it be okay to make a mistake;come up next on iyanla fix my life;be you ready to do the work to fix your life and become the best version of yourself the fix your life weekend at the beautiful you will learn the skills amp tool to open your mind amp heart to the greatest possibilities for your life;when we be will to learn what we do not know and use our experience our perfection will begin to show;first eliminate fear anger and imbalance in your life then you can move forward to create the change need in the world;it be time to get to the truth on an all new episode of tonight on at 98c;it be not about what we look like or what we have it be about take what we have and do as much as we can with it;iyanlas anti viral mssage;iyanlas anti viral mssage;be back with an allnew episode tonight at 98c on;affirm the world i want begin with me;only fix leave and this weeks episode be one bumpy ride tune in to saturday at 98c on;new improve audio content update available mind matter meditations to soothe and heal the mind by iyanla vanzant,Normal
419,check this out 100 college acceptance for the young black princes of capital harlem prep way to ho;when we be alone we have an opportunity to get in touch with to talk to and be guide by our power source spirit;affirmations be a positive step toward bring into your existence all that you need and want;to be alone be the best thing we can do for ourselves to be alone mean take the time to give to yourself;i believe that it be worth the effort to try affirm the best rather than rehearse the worst;daily guide spiritual principles to live your best life awaken app new content now available;we create by repeat the behavior pattern that feel comfortable whether or not they be productive;nothing be ever as it seem what look bad today can be a bless tomorrow;iyanla read the prayer of surrender from her book every day i pray take from iyanlas daily anti viral message day 45 originally air on may 5 2020;we create with our thoughts beliefs and expectations;if we want others to speak well of us we must first think well of ourselves;these 5 principles if apply daily will reap positive spiritual amp physical result they be truth order love faith amp patience;life be a series of unfold possibilities opportunities that be ignite by the choices we make moment to moment;you be invite 3 step to money forgiveness with lynne twist if you be ready to complete and forgive your past money mistake open a new channel for prosperity and flow in your life then click here to join the free 10minute teach now;the spirit of god be within you and when you pray you be surrender the demand of human will to the presence of divine will,Normal
420,life be about so much more than we can imagine yet we must give ourselves permission to imagine it if we want to experience it;subscribe today amp get all new daily principles wake up iyanlas voice alarm feature and more;prayer be like plant a seed do not dig it up to see how it be do pray for it release it by give thank;we create with our thoughts beliefs and expectations we create by repeat the behavior pattern that feel comfortable whether or not they be productive;it be difficult to distinguish who we be from what we have be tell we be or what we have be teach we be;life be about seek search and discover in order to grow we must question challenge and ultimately find solid grind in our spiritual quest;beloveds you be perfect just as you be;no matter how painful an experience be at any moment you must know that you will be okay;new content download the awaken app today;surrender and release all negative toxic unloving thoughts about your body and accept yourself as gods beautiful creation;affirm i be all that god create me to be and i be experience and express that truth moment by moment;what do you believe about your body and what thoughts be you feed yourself consciously and unconsciously;we all come from and be connect to the same spirit the same essence the same life;your body be a live organism that hear and believe every think you think and every word you speak;it be foolish to believe that you be on your own separate from anything or anyone or separate from god,Normal
421,well beloveds i hope you saw something good you can use for yourself in tonights episode thank you rev coach latonia taylor for bring these 4 beautiful woman to the table thank you everyone for watch see you next week;do not buy a condo and stock in the misery and the pain get the lesson and move on;lesson very often what feel like a weakness be your heart say do it different but different be so unfamiliar we default to what we know false strength and unnecessary responsibility;i be sit watch this show like i be not there lol what lesson be we on now because there be a lot of lessons in tonights episode and there be only 3 more leave;lesson when someone be behave badly rather than judge and condemn ask yourself how much pain be this person in to behave this way then use compassion to heal yourself from the impact of their pain;power can be gentle success can be soft heal can easy when we make our vulnerability a strength rather than a weakness;as women if we just lay aside the masculine energy of competition and share our hearts with one another we would experience ourselves more as sisters and ally rather than adversaries;i encourage every father who have a daughter to watch this episode it be a cautionary tale about what happen to the little girls who do not have a daddy to love on them a daddy be a womans first love he set the standard of what she expect and accept from men;lesson if you be barely light and dimly glow the people you attract will represent and demonstrate your dark place;lesson the quest for perfection more often than not grow from an internal sense of imperfection the quest therefore be not to be perfect but rather to prove to yourself and others that you be not imperfect inadequate and unworthy;lesson when a relationship any relationship endsdies it be important to give yourself time and permission to mourn a relationship be a live breathe energy when it be over it be natural to experience and express loss;lesson when you withhold communication affection of important information from those who love you it be an act of violence;self inquiry pop quiz who be i when i deny what i want do what i do not want to do and sacrifice myself for others;lesson when you hide your true self your true feel your true desire people will fall in love with who you be not then when the real you show up they be shock and horrify and so be you at their response to the real you;how many women do not know how to be powerful and successful in the world and sift gentle and vulnerable at home it can be a challenge for us to leave the world in the world,Normal
