user_id,tweets,status
157,i be over it i say because i would clearly never be over it;i do not want to know how i feel;i mean i be never not go through a difficult time;i love set boundaries and then be annoy by them;no i do not remember how to dress myself;insecurity be forever;no of course i do not tell you my feel be hurt;i hate that we have a connection;and it be back;i have a headache probably because i exist;go back to bed forever;probably cry;i know feel cannot kill you but like i kind of feel like they can;what if i never stop grieve and then i die and still have to keep grieve;i be call on my feel to please stop,Depression
158,it be always the anniversary of some dumb shit i have do;i like the denial stage better than whatever this one be;why be i not excite about my inner beauty;you be damn right i never leave my comfort zone;thank but i will be my own worst enemy;bring your own serotonin;say something nice to myself but then be like you be wrong;be it cool if i channel my anxiety into be obsess with you;what the fuck be everything;i do not really see the point of me;take shit personally so i can feel like i matter;think about skincare and death;the seven stag of get out of bed;rejoin society honey i never join;no human interactions thank,Depression
159,aug 10 cometh superdoom an anthology of my poems ft the good shit from my 3 out of print cult booksmother meat heart amp scarecroneamp last sext new intro by me get a sign copy;forgive myself but then forget;what be wrong with me the musical;university of avoid feel;i mean fuck everything kind of;well today be already destroy so might as well fuck it up some more;watch myself get more insecure in slow motion;when people talk about selflove i feel like they be joke;someone send me love and light but i never get the package;i love get attention and pretend i do not care about get attention;awwww look at these cute red flag;sorry i cannot i be contemplate my cosmic aloneness;reminder that after 5 minutes i always want to leave;i never do trust hope;say no to everything,Depression
160,i be a silence addict i need more and more silence just to maintain;try to figure out what to regret;i do not have selfesteem but i do have an ego;what do stay strong mean and do i have to;do i support the politics and value of people i be follow honey i do not even know who the fuck i be follow;what be the point yo;anxiety or it do not happen;do not be paranoid nah i will be paranoid;when people be nice to me i panic;i be not brave i be just impulsive;be i go to get in trouble for be me;i be be true to myself by sleep all the time;i be very no;feel slightly off so obviously die;power by insecurity,Depression
161,come hang out with my anxiety;when i hear people talk i honestly feel like i be from another planet;let us feel bad for each other;if i be a tree i feel like it would not be that cool of a tree;i be fine to be around people for five minutes or less;this be a long apocalypse;my version of impulse control be just regret;university of existential aloneness;i do not trust life;q be everything get shittier a yes;no i cannot just face reality;sorry but i hate everything more than you do;bad decisions be so excite;not sure how to exist;i give great advice to everyone except me,Depression
162,we should lose hope together;when you realize the person you be obsess with be just a person it be sad;no of course i do not know what i want;it feel good to know you suck now;i never know what i be feel because i do not want to;spoiler existential crisis;high on regret;no i be not go to feel my feel;will reveal my need make me unloveable stay tune for the thrill conclusion;i feel confuse but too tire to grapple with the confusion which be in a strange way a relief;we love you gian;oh look it be a hell of my own make;no i do not know what the fuck be go on what do i look like someone who know what the fuck be go on;i be cool when i be alone;whisper during sex do my stupid life look ok online,Depression
163,i like it when i do not know you exist;i love when i be not awake;be alive seem weird;i can only do like half a thing per day;maybe i be not suppose to be ok;by relax i mean anxious;i fear miss out and be include;sorry i cannot i be compare myself to strangers on the internet;why yes yes i do hate everything thank you for ask;when something appear good it be usually bad;the best advice i can give you be do not listen to me;let us roleplay you not be an asshole;three years ago my friend come over and eat a banana at my house and we start write a thing and it become a thing;if you need me i will be worry about shit beyond my control;may i interest you in my passive aggressive attempt to be sort of okay,Depression
164,come soon disappointment;hello humans my book be on sale;i will give me something to cry about;the future be annoy;i would consider get out of bed if the world be another bed;i would like to be more attractive;other people make me feel the very loneliest;be we dead;when someone flirt with me i be like do not distract me from the existential truth of my mortal aloneness unless you be ready to expand into the size and shape of the void and stay there;i like to greet the new day by go back to bed;this book good;everyone like it so i know it be bad;listen i have have enough opportunities to grow;my selfdoubt be beautiful;i fear the unknown and the know,Depression
165,spoiler nature hat us;proud supporter of the i do not ask to be bear defense;it be all good me lie;i reject me before you do;when i be eat in a bathroom that be the real me;oh god the fuck future;sometimes i remember i exist and i be just like oh no;let us softly destroy my life;i invent freeze yogurt;be i actually suppose to like live my life;when something good be about to happen i feel like it be already over;i pretend to be strong so people will leave me alone;can already tell that my fate be go to be annoy;when i be alone i be almost okay;house of the rise anxiety,Depression
166,someone ask me how i be do and i tell them and it be way too much;i hate when the things i need to do to stay alive interfere with my dissociation;let me know what i can do to make you like me;here i make you this mistake;have a nightmare that i have to talk to people;imagine think you be right about anything;what be this oh just my core underlie issue;have fun feel your feel i will be over here avoid mine;be alive feel like a problem;i mean i would not hang out with me;i rectify this with my ouvre;everything annoy;teach me how to leave the house;i prefer to not do anything about my problems but still worry about them;let us ignore everything,Depression
167,what do you mean do not vent about the person who break your heart to the person who break your heart;the best years of my life be not that great;my mom hi me i be bear nonconsensually;i do not like anyone or me;too tire to learn to love myself;i keep make little noise like grnnghgh just to make sure i be still alive;if it be bad i assume it be about me;heal loneliness with isolation;i keep mean to be a different person;stay strong seem fake and unnecessary;i fuck love cry i just forget that i love it;want to see a video of my father okay;what do stay strong even mean;i be tire of keep it together and i be not even keep it together;whatever i be do i be actually cry,Depression
168,do not forget to take your antidepressants;buy my book fuckheads;think about death and my hair at the same damn time;a corporation be try to give me a lecture about empathy;selfquarantining 4ever;forget to drink water for a year;i be not moisturize hydrate or fill with selflove and it be fine;imagine if this become one of those positive affirmations account lolol;ok that be enough today for me go back to bed;make the mistake of wake up;can we have a zoom meet about why you reject me;sometimes i be like maybe i do not have depression anymore and then i do;guilty;sad;oh look it be a loss of interest in things i once enjoy,Depression
169,i be basically just a nap wait to happen;be you subtweeting me i do not know be i;tonight will be good febos rule;i be still afraid of my own feel the musical;the 500000 stag of grief;it be not that i want to be another person i do not want to be any person;have i find selfacceptance no do i reluctantly tolerate myself also no;u200d u200d to whom it may concern u200d u200d me wednesday u200d u200d;i have not find inner peace;block my thoughts and feel;may the miracle of passover shine in your heart forever;oh hell no me every fuck second;no i cannot just get out of bed;fear of the future be my natural rest state;these book be good,Depression
170,i do klezmeradjacent baybeee;stay awake be a problem;i feel like i be over everything but not enough to avoid disappointment;first day of period no tampon in no underwear on too lazy to get up and rectify the situation like the punk i fuck be;the lose art of shut the fuck up;spoiler still not enough;i be aware of what i be do but not enough to stop;i be read tonight;for the love of god can someone just get me out of my body;feel anxious about my face;honey i be my own hater;one thing i be into be a peaceful death;some of you be love unconditionally by your mother and it show;my avoidant attachment style say hi;what be the difference between my two twitter on here i spell it cum on i spell it come,Depression
171,i be either totally silent or totally oversharing;one thing i do not like be the way things be;my face really get on my nerve;hey sorry to bother you but can you quickly validate my existence;if you cannot handle me at my insomnia then you do not deserve me at my sleep all day;sometimes i think my selfesteem be get better and then it be like;why cannot i be your crush;whisper during sex do you think i be enough;my version of integrity;live in fear be my thing;sad tonight;i just want to sit quietly with my father;i wish i be a bagel with cream cheese;forgive myself but then punish myself for something else;when be awake be not work,Depression
172,donate my tweet to science;try do positive affirmations and be like but what if i be wrong;i feel overwhelm and i be not do shit;still confuse by this just go to chill till someone tell me what to do or i turn 65 also do not understand what an nft be;please keep society away from me thx;i be in moderate emotional pain;i love blame myself for shit that do not involve me;i cannot wait to tell you about my suffer;director of leave me alone;my body disappoint me more with each pass day;i be not the only one who struggle but i be the only one i spend time with;i be awake and ready to be mediocre;i miss my home planet and have no idea what it be;if you cannot handle me at my constant state of exhaustion then you do not deserve me at my caffeinated burst of anxious intensity;what day be it,Depression
173,nothing good happen out of bed;be i ready to become a better me not really;i be not that good at be a person;i cannot i be selfsabotaging;my daily affirmations 1 uh oh 2 oh no 3 oh shit 4 oh fuck 5 fuck no 6 hell no 7 oh hell no 8 noooo 9 fuck 10 fuuuck 11 no;i be always kind of simultaneously annoy and turn on;i be a loser and it be fine;oh great another day;i think i will spend the day imagine the worst;spend five hours on pornhub when i mean to jerk off quickly and go to bed the musical;what my brain teach me about selftorture;what a bag of doritos teach me about the seven stag of grief;i have a lot of feel none of them good;today be not what you would call a good day;it me,Depression
174,i like pics where you cannot see my body or face;brb figure out how to live;i like to pretend that if i do not want to have a feel i can just not have it;my book recs;me n;no i cannot just accept myself as i be;the best be when everyone shut up;i always assume i be totally fuck just to be safe;look in mirror i do not trust you;no matter what i be do there be a little voice in my head whisper what be the point;today be the first day of the rest of my nap;want to text someone hi be just think about your dick but that be how every great tragedy begin;how do you get vaccinate feel confuse can someone wake me up when it be my turn thx;too tire to figure shit out;so to make a long story really fuck long,Depression
175,masturbate to a soft pretzel;milk feed by melissa broder;i be bad at reality;how do you be nice to yourself without think it be a lie;i be always star at people because i be just like shock they be fine with be alive;always look for evidence that i suck;it be hard to reach out and tell people what i be go through because then i have to talk to them;talk to my dear friend brad listi about a bunch of shit i forget what we talk about;horoscope a lot of stuff hurt;time not spend nap be a waste;judge others be your drug;tonight amp me 6 pm pt;i wonder if people hate me more or less than i think they do;ignore at first sight;fear of failure keep me warm at night,Depression
176,start to think that feel be just go to keep happen;wish my mind could wear a condom;i just want to not feel this moment;i have a crush on 20 people none of them real;well everything remind me of die;for the night crowd;i build this hell and now i be go to eat a snack here;i want to start a club but like alone;feel like sopranos get all the love and family matter do not get shit;i feel confuse;why do everyone have to make everything so stupid;lie to myself feel like a soft cashmere blanket;day me you will be go to bed early tonight missy night me no;hope just do not feel safe to me;yo tell your mom to buy you my book thx,Depression
177,what be this oh it be just the pile of shame i carry around;no i do not trust myself;content warn the inside of my skull;i be not good at like know what be happen;run away from the question how be you;i do not choose the irrational fear the irrational fear choose me;can never tell if i be fight my demons or just hang out with them;i listen to my intuition and it be stupid;my relationship with myself be bad;recent study show that i be tire;i be very consistent i be always paranoid;i love comfort myself with compulsive behaviors;my selfesteem be good for 10 second;i want to sleep but my phone want to be hold;my mind be full of terrible ideas,Depression
178,give up be the best;what if i do not have to be a functional human be but all this time i think i do;due to personal reason i will be ignore you;her nonpms tweet lack the cold eye and blister verve of her pms tweet sylvia plath ghost on my tweet;do not ask me for shit;go away;damn i hate everything;whisper during sex leave me alone;i be not heal or whole and it be fine;life be an annoy journey;just think why be i suddenly paranoid no one like me but i be always paranoid no one like me;ok tomorrow be last online event for milk feed it will be good bc be w my dear kristen iskandrian amp we go way back in old alt light world lolback back when it be call indie light she have her own damn bookstore now;be myself by sleep all the time;listen it be not my fault i want to sleep through my life;passive depressive,Depression
179,no of course i do not tell you i have need;my instagram be a piece of shit;feel sentimental about shit that never happen;we need to talk about me go back to sleep;my friend group be cereal and a dog;wish everything be as easy as believe my own bullshit;talk about the eat disorder disorder eat elements of milk feed with the rad amp astute content warn uh the whole book basically;i be a strong independent woman who need constant validation from strangers;cannot tell if people know they be full of shit or have no idea;in my head i be have sex;do not recommend me anything except a peaceful death;shit i be do this week amp you do not have to leave bed wed 6 pm pt talk to my fav brontez purnell abt his new book 100 boyfriends;lonely but not for people;we have a nice time together do not we twitter followers;i do not like you anymore and it be beautiful,Depression
180,my insomnia will always be here for me;i be always last to know anything because i do not want to;cannot believe this life thing be still happen;whisper during sex my mother will never be proud of me;this account suck now but that be the way of all things;milf head;milk feed on the today show;435 thank you;philly online tomorrow night;rediscover nothingness;oh cool society be still gross;what if i be just an old piece of bagel;review of milk feed;listen do not make me regret pretend i be fine;this book be good,Depression
181,what do a typical day look like for you i forget all passwords and make new ones;do not make me do the emotional labor of type haha;stop peerpressuring me to type lol;sometimes i be scar that inanimate object will judge me;take shit personally as fuck;tomorrow nightme and one of the only people i likeryan oconnellare do a virtual thing at you do not even have to leave your bed register here;selfdestructive in a gentle way;listen to jd;just relax and think about the die process;i be not lie to you i be lie to myself and share it;tire until it be time to sleep;please god no more selfawareness;excerpt from milk feed;excerpt from milk feed;me fuck societys beauty standards also me i look disgust,Depression
182,i miss the things that destroy my life before they destroy my life;i be in denial;tomorrow night;i be naturally desperate;greet book club amp other group of 7 read humans i will zoom into your book club to discuss milk feed ideas about life after death and anything else i can also mail you sign bookplates hmu email in bio;i do not want it to end badly i want them it to end with you be obsess with me;i be anxiety;milk feed it be not go to eat itself out now from me;milf feed;for fun i like to obsess about shit i cannot control;i like leave;my shit come out tuesday;me social media be just the last dregs of a dopamine addiction also me give me the dregs;pretend to be chill so no one know i have need and therefore cannot reject them;help i cannot stop feel,Depression
183,you cannot make a person love you but you can pretend they do;i take the good shit lightly and the bad shit personally;the world be like hi sorry still turn;how do life just like keep go;i want to be a cloud i think;god grant me the energy to go downstairs and eat a disgust snack;sorry i cannot i be busy lose interest in things i once find meaningful;find new ways to be not enough;i want to live in three moments of my life and delete the rest;everyone be sort of blend into a big blur;milk feed it be not go to eat itself;who play theo;the ancient art of blame myself;i do not take it personally i say and take it personally;i be an entrepreneur of ways to feel shitty,Depression
184,me get selfesteem;be it unconditional love or do i just have no boundaries a memoir;therapist i can help you me you still use aol;hi please come to these zoom events i be do for my new novelmilk feed i will read talk shit and answer question all events be free link to register be in the thread of tweet reply to this tweet thank you;two nurse have be find thank you twitter goodnight;do i have a follower who be an icu trauma nurse who wld have time to talk for a few min on phone personal not for an article just need an ear amp some word of wisdom perspective where it be not an onduty hurry set you will be do me a great service lmk amp i will dm you;i feel like an empty well;oh great i be awake;common courtesy;ask me how i be do be rude;i be always the last to know everything and i be glad;shoutout to my demons;mood;whatever;mentally i be always in bed,Depression
185,do i like you no do i need you to like me yes;i have be awake 5 minutes and it be already too much;call me steven spielberg;fear of rejection be so cozy;i may be selfcentered but at least i be not judge others;so you think you can go a day without overthinking;i miss when i do not exist;honestly do not know what the hell anyone be talk about;horoscope if you think they be fuck they probably be;everything be get worse in a bore way;the team of imaginary people judge me in my head be work overtime today;todays agenda regret past fear future;can you just give me a powerpoint presentation on why you reject me;do not ask me how i have be;i go in the studio amp record the audiobook of milk feed the engineer have never hear the word clit repeat so many time also knish anyway it be avail from for preorder audible,Depression
186,already stress out about my funeral turnout;listen it be not like i choose to exist;kiss me like i have a life;these book be good;i do not understand how people just like live life;i always think everything bad be about me;in other newsthe first chapter of milk feed be now online;my dad have be in the icu on a ventilator for three weeks after he be severely injure in a car accident i do not want to tweet this because it be his life but i be too tire to tell people individually so there you go his name be bob broder i love him;this year suck;i like to be awake when i be suppose to be sleep and asleep when i be suppose to be awake;you need to love yourself listen if i know how to love myself i would be do it;be bear be a lot of pressure;uk represent;there be two type of people and i be isolate from both of them;these be dark days me since birth,Depression
187,all i want for xmas be validation from strangers;vogue say read milk feed feb 2021 cool;i feel lonely and weird;my heart be stupid;fuck everything kind of;shhhh listen it be the sound of everything get shittier;i be insecure do that turn you on;yearend list i be very tire very very tire i cannot get enough silence love darkness love close my eye;overwhelm by most things;honor and grateful that i be go back to bed;level 6 sadness be wash away by a deeper purer level 9 sadness;who be i and why;milk feed out 22 get it;yell at the mirror it be your fault i be like this;do thoughts and prayers work,Depression
188,feel doom;wake up remember i be a powerless speck of dust in an uncontrollable world go back to bed;obsess over a problem that do not exist;sorry but i do not want to do what be good for me;my attitude be good for two minutes;i want sex and to be alone;it be nice to see your personality be still fake and bore;not have a crush on anyone be go to kill me;i be not good enough for me;no of course i be not go to relax and enjoy life;hobbies feel guilty for things that be not my fault;fuck yeah i confuse love with attraction;on some level i must actually enjoy imagine the worst possible outcome;i want to be more at peace with myself but also more hot;i be annoy about something but i forget what it be,Depression
189,be reject be goth;do you know this account belong to a writer a human a human w feel a human w feel she tweet to avoid feel the writer have a new book come out in feb call milk feed if you like these tweet amp want to support the human preorder it;oprah like milk feed;one book that be not on here that be hotttt be brontez purnells 100 boyfriends out in feb;ok so this list have a lot of good shit girlhood by love amp other poems by and i do not know that amp have new book also me;my wound child feel like your wound child be talk shit about her;shhhhh i be heal my wound child;whisper during sex i be go back to therapy;go to have to start social distance on text too;love conquer all except unrequited love;no i cannot stop apologize for my existence;remember when i think i know you but i do not know you at all;high on loneliness;want to lay on a bathroom floor with you;i need to warn you that i be go to be a disappointment,Depression
190,peace love and sadness;i feel empty and insecure dot com;on a scale of 110 how big of a loser do you think i be me flirt;i feel like everyone be cosplaying life;sad today;do not get a text within five second it be all over for me;i have all the wrong clothe body and mind;i do not remember ask to live in this dimension;happiness be cancel;i fall in love every five second;i consider not take your advice a personal success;some people believe in themselves so much it be terrify;never be enough be a lifes work;that which do not kill you but make you project your insecurities on everything;no i do not have any fun weekend plan,Depression
191,felt a feel so now i have to tweet;i should be back in therapy but i be tweet instead;pre order my new book buttheads;me the team of people judge me in my head 1 household;awake when i be suppose to be sleep asleep when i be suppose to be awake;oops totally do not mean to be emotionally honest;you want it;so not in the mood to stop lie to myself;i love give up;i will always be here for you in a distract way;that emptiness look cute on you;memories be try to kill me;powerpoint presentation of my insecurities;without download new pics what be it like date you;i be fine 𝗧𝗵𝗶𝘀 𝗰𝗹𝗮𝗶𝗺 𝗶𝘀 𝗱𝗶𝘀𝗽𝘂𝘁𝗲𝗱,Depression
192,feel like i be wear a trash bag of anxiety;watch myself fuck up in slow motion;i have a headache from life be really long;felt a feel and repress it in under one second;her life have become a nap punctuate by internet;if you need me i will be eat alone in my car;every time i get out of bed be a disaster;okay you be hot we get it;wish it be me ignore you;make emotional progress throw it in the trash;sorry for be a person;i be do be afraid i say and be still afraid;i be do with this bullshit i say and then keep do it;i be only interest in go back to sleep;brb misdirect my anger inwardly,Depression
