user_id,tweets,status
287,cannot wait until i have such an awesome time cosplaying valeera on the hearthstone stage in 2015;the closer i get to graduation the harder my quarterlife crisis kick in;good morning twitter;me after my first 12hour shift as an almostnurse good night;the one nice thing about not feel well be have an excuse to eat more ramen;my favorite thing about today be my sushi sock;so excite to be move to the most marvelous house in california next month;now that class be do and i will be stream more what do you guy think about make a tharja cosplay together;30 later and my day have be bless;no one talk to me for the next half hour i be be reunite with my girl mikasa;finally do my lol placements at 8 be in the dark with no sleep jfkdslaj;552 be why be i still awake t_t;get me like;just get assign to inpatient rehab for my residency then do esports at night can i be nurse akali yet;do not know nyquil do that x_x,Normal
288,i just finish my last clinical of nurse school one more week of class then i do my residency;root for on one screen and wait for on the other this be my life now;me after spend the weekend sick cover smashow and prepping for finals;girls night in with;receive pho pack and deliver to my door have science go too far;nothing be better than take your salt out on league so you can share your happiness with others irl;pizza fake tornadoes and video game d;happy from my little dragon slayer peanut butter;our sub badge from the insanely talented just come in cannot wait for them to go live in a few days;ahhhhhhh i just pass my nurse school exit exam so excite to not use my degree and do esports ltgt;mrw i see hollywood be try to make another liveaction movie adaption of an anime do not ruin death note too;jk get bribe outside with mochi and sushi;happy belated first day of spring;between ca sxsw game school i think i burn myself out on socialize for a bite if you need me i will be curl in a ball gtlt;escape room family dinner and car karaoke with these guy i will be count down the days until we be reunite at dreamhack austin,Normal
289,celebrate my 21st birthday again with steak alcohol and two table full of friends and alcohol;okay guy before anyone try to pinch me at the airport be close enough to green right;what clean clothe you have mom would be a shame if someone roll their dirty hairy ass in them;do not play with your food they say you will never get a bf they say;anyone feelin creative be look for a creative director come join the;find you a girl that take you on two ice cream date in a row;visit the salon yesterday i be a galactic unicorn princess;this be what happen when they give me access to the snapchat come hang out with us at immortals_gg;happy feat the laziest fluff i have ever meet in my life;at lcs with this babe and the;have a pawsitively wonderful spring break;middle seat be empty so this lucker dog get his own seat on the flight to california;just finish my last class so excite to spend spring break in california with friends food and drink;so happy to celebrate my 21st birthday and all of the hardworking beautiful women around me cheer;birthday stream in my birthday dress live now until 830 pm cst,Normal
290,i want a hanzo cosplay for my birthday tomorrow ʖ;someone park in my reserve spot at home eat ice cream and kill peep on the rift until we feel better;cheer on before hit the gym cannot wait to root for our team at lcs next weekend;peanut butter be excite to stream live now at;share my research on videogames in healthcare see logan then super long saturday stream tonight;finish my research poster to present at a conference tomorrow before super long saturday stream why do the uni fund my bs;sorry for no stream get catch up with nurse stuff todaylet us do a super long saturday stream to make it up;finally step up my shoe game need more teal to wear to lcs next weekend;midterm project get me like;macaroni and fee finish my postwork snackaroni then hit summoners rift;finally set up an appointment with the amaze cannot wait to go back to crazy hair color this spring;the senioritis be kill us two more months until graduation and game;i be 11 hours into a 12now 13 hour hospital shift because night shift be run late can i be fulltime esports yet t_t ff;make so many new friends on social eat today that i accidentally finish a whole tub of ice cream gg _ツ_;mfw i be wait for class to end so i can go home shower and stream with you guy,Normal
291,cannot believe i find poke in austin it be like a burrito bowl of sushi;if i be go down i be take one with me thank for watch me fee and hang out during the series see you guy thursday;just submit our new emote to twitch thank so much for the adorable art live in 5 min;happy to my little love peanut;life kick my ass today go to have ice cream and get work do stream postpone until tomorrow at 4 pm cst;hit the gym so i can carry my team irl;we be all smile as take it to game 3 versus;two nurse interview today cover lcs tomorrow wat be life;good night from our happy little family;cookies just get here time to stream d live now at;we be look for a new member for the come join the staff as a graphic designer;i know you play flex but you be still the support to me happy valentines day;spend alone with my pizza gg;chillin in my owl kigurumi while we hide from irl responsibilities and play video game on stream _ live tho;stream from 430 pm to 730 pm cst see you guy soon,Normal
292,update it be 951 pm i have finish all of ngnl season 1 but not my paper;watch no game no life while finish my paper i think i find my new waifu;my valentines wishlist;play outside today graphics be 1010;rip we cave boys 30 dollars later we have a fully upgrade castle and no azura;hang out in social eat while i finish my rabbit food;career fair take way longer than i think go live at 530 pm cst;my castle rn roy be our boy;tech issue persist and we be rip streameroni on friday to make it up to you guy at 5 pm cst;late stream 710 pm cst due to a combination of technical difficulties amid a major assignment and tilt off the face of the planet;who need sleep when you can roll three copy of roy;okay i can go to sleep happy good night friends;long day guy peanut and i be all pooped after midterms time to grind fire emblem instead of study;takumi and camilla in one roll;mfw i finish midterms today and only miss one question new cover photo hype ヽຈلຈﾉ,Normal
293,hot date;last sem of nurse school be so bore wish we be play ori and the blind forest instead;have a wonderful time play ori and the blind forest tonight thank so much for the host and thank everyone for hang out;doggo be bore because stream be run late we will be live in 10 minutes at 415 pm cst;rip professional headshots speak of my professionalism what game should we play on stream at 4 pm cst;rewatching puppy bowl highlight and cheer on basically my life in one picture;also make a new webcam overlay;it only take me all day but i make my first stream overlay cannot wait to try on our monday stream at 4 pm cst;it be the first time in a long time that pupper and i have sleep past noon and we be still not ready to get up;think i escape the pax pox this year nope;great first stream back we beat stick of truth bump into in aram and get notice by senpai ggwp;first postpax stream live in 20 minutes at;morning guy pupper be upset i turn the light on so early stream at 4 pm cst today;new profile pic who dis;still not sure how i feel about this,Normal
294,skip stream today to catch up on school postpax week 210 of clinicals complete;finally find a game i can beat and at;so proud of for win first at the nge winter premiere at pax south ggwp;guy guy we get level 100 girl armor tonight and a wig that match edgy high school bianca hair;thank for a wonderful stream with host from and see you wednesday 48 pm cst at;just finish my last first 10hour clinical before become a nurse stream at 4 pm cst;pregame protein shake leggo;feel foureyed after an optometrist appointment hit the gym then play stick of truth at 8 pm cst;who be we go to see at pax south next weekend;long day back at nurse school ready to social eat some comfort food before get on the rift;hello i be baemax your personal healthcare provider stream at 7 pm cst at;first day back on the college esports doublelife grind consider ffing life;fell behind on life so no spontaneous stream today look forward to stream together every monday and thursday 48 pm cst;thank for join me for 10 hours today super see so many old friends and make new ones excite for more south park with you guy;first stream hype ヽຈلຈﾉ start with social eat while set up play league now,Normal
295,first stream ever in 1 hour what have my life come to at least i finish my pc _ツ_;it be like christmas all over again;from match drink game card to almost match birthdays i be so lucky to have meet my perfectest irl duo;it be not esports without the bm;we esports nowヽຈلຈﾉ;cheer on my boys who just take the first map over in the winter premiere;spend the holiday game with love ones;um wtf;those horizontal suckers be get rip out of my face on tuesday what ice cream should i eat for the next week;can someone tell me how i have not age since myspace;wonder if there will be more harleys than girls in animal ears tonight;happy to my prince charm my bubble buddy my weirdo and my nerd;so lucky to be the irl support for the best flex player in overwatch;my dog be my spirit animal;first night back home be a success 69 pokemon catch and see with reckful toez and the lovely,Normal
296,pokemon battle irl we catch him d;break news nintendo cure americas obesity epidemic with;best seat at besides;the best part of;so excite to bring you the best esports cosplay at in this epic video of cosplay awesome by;cosplay grind to make genji with check us out on her stream tomorrow at 4 pm cst;doodle and game tonight;doodle my way through work orientation four more hours till the cavalry be here love;actually go outside today with 1010 graphics;admining the tavern hero tourney with at;tavern hero from atx will be move forward tomorrow in the spring prelims;my player 2 be upset we be study for finals instead of dumpstering noobs;those who only know what they do tend to work harder those who know why they do what they do tend to work smarter;the best way to find out if it will work be to do it;if we learn to start with why and share the reason that we be passionate for our work we give people an opportunity to connect with us on a deeper more human level people do not buy what we do they buy why we do it,Normal
297,to get on a path to success we need a plan to reach success we need to be flexible when the path be block;to be authentic be to be at peace with our imperfections;that idea be so fantastic stop talk about it and do it;in a transactional industry practice honesty be one of the most effective ways to distinguish yourself it might not always feel lucrative in the moment but authenticity pay dividends in ways you might not think;say it only if you believe it;great company do not offer us something to buy great company offer us something to buy into;true courage be have the strength to admit our weaknesses;in an infinite game there be no win instead think of your competitors as worthy rivalsanother player in the game that can reveal to you your weaknesses;success will buy you a new house fulfillment will leave you inspire when you come home at night;a poor leader will tell you how many people work for them a great leader will tell you how many people they work for;the experts be the ones who think they know everything geniuses be the ones who know they do not;skills like effective confrontation empathy and patience be not soft skills they be human skills and they must be learn organizations often overlook their best internal leaders because they do not place enough value on these crucial interpersonal qualities;to play it safe mean you will always end up with mediocrity;you know something be good when you be eager to share it;it be easy to be honest just tell the truth,Normal
298,as impressive as our brain our sometimes they have a tendency to work against us take control of your perspective be a challenge but it will ultimately make you much more likely to succeed;the genius at the top do not make the team look good a good team make the person at the top look like a genius;there be only one way to avoid criticism do nothing say nothing and be nothing aristotle;all success start with one one step one client one order one sale while dream of greatness be great we must remember to appreciate the joy of the start;difficult conversations be challenge for a reason they require skill and hard work to effectively navigate we have an opportunity to step up and systematically impart these skills to our people so they can flourish at work and also in their personal live;people be always more important than number happy people make happy number which make even more people happy;the drive for order interrupt the beautiful chaos need for creativity to thrive;our best competitors reveal our weaknesses the goal be not to beat our competition but rather to improve ourselves;language matter when we talk about ourselves everyone fall but what be important be pick yourself back up and if you be in the right place others will be there to lend a hand;when we help ourselves we find moments of happiness when we help others we find last fulfillment;service be not an ornament it be a touchstone;we must be certain where we be go and keep an open mind as to how we will get there;we should not assume that a lack of motivation be an intrinsic problem as leaders we should first evaluate whether or not we have create an environment that inspire our employees in order to spark motivation people must feel see and value;there may be pattern for the things that succeed that do not mean there be a formula for success;impatience come out of a need to control need to control come out of fear omar brownson,Normal
299,talk less say more;to be innovative we cannot look to what others have do the whole idea of blaze a path be that there be no path there before;every other clevel executive have a title that reflect their job description yet what exactly do a chief executive officer do we need to start fill the role with leaders who be equip to carry out a vision and we can start by change the title;bad leaders may edit the truth for fear of cause discomfort good leaders accept that the truth be often uncomfortable;the only way to find out if it will work out be to do it;good friends make us better people they cheer us on when we hit bottom and keep us humble when we reach the top;trust be not form in meet room or on conference call it be build when we be able to connect on a personal level outside our normal work obligations it be crucial that we create space virtual or in person that be dedicate to simply spend time together;when we take care of our people our people take care of our business;a small team commit to a because bigger than themselves can achieve absolutely anything;do we want to die rich or do we want to die happy focus on rich we may end up happy focus on happy we will likely end up rich;value be verbs not nouns in order to build the culture we envision we have to enact our value in how we show up every single day;follow a plan be good for progress opportunity however usually exist off the plan;get a question about anything whyrelated reply to this with your question and then join me this friday may 28th at 3pm et12pm pt for a live qampa right here on twitter and if you be ready to discover your why start here;when in doubt be yourself;love our work be a right not a privilege it be the responsibility of leaders to cultivate work environments where people feel safe inspire and fulfil everyone should be able to wake up in the morning and say i love my job,Normal
300,the joy of leadership come from see others achieve more than they think they be capable of;in highstress time it help to laugh which be why i call michael mcintyre one of the most successful comedians in the world and that be what we didwe laugh this be a bite of optimism listen at;integrity be do the right thing even when no one be watch cs lewis;safe be good for sidewalks and swim pool but life require risk if we be to get anywhere;if you be feel overqualified for your current role put yourself to the test by try this;leadership be not about be in charge leadership be about take care of those in your charge;in a world that be increasingly polarize it be harder to bridge the divide between ourselves and those we disagree with;great leaders do not see themselves as great great leaders see themselves as human;from order come progress from chaos come innovation;believe it or not you already have a profound impact on the live of the people who be closest to you you just have to ask the friend test be an easy and fun way to discover the core of your why;change the world take more than everything any one person know but not more than we know together so let us work together;spotify target and twitch be just three of the brand whose identity have be significantly influence by brian collins he be a legend in the design world and think about the future in ways completely different from everyone else listen anywhere you stream podcast;to overcome our challenge all that be require be the courage to ask for help;do something big or do something small but stop wonder and go on an adventure;when we ghost someone we leave them question themselves and their selfworth simply because we could not take a moment to confront them we need to educate people on the skill of have difficult conversations,Normal
301,emotions be like vomit you can only hold them in for so long before they all just come out and by that time it be pretty messy;confidence be this thing we all needthis thing we all want some seem to find it easier than others sara blakely the founder of spanx find it and it work this isa bite of optimism listen at;the only ones who fear failure be those who have never taste it;when we know why we do what we do everything fall into place when we do not we have to push things into place;compare ourselves to others might be natural but it be also deadly by take an infinite approach and reframing your competitors as worthy rival the success of your peer become fuel for your own growth as oppose to the source of your insecurity;whether you think you can or think you cannot you be right henry ford;if you ask people in the military what make them will to sacrifice themselves for each other the answer may surprise you it be not god or countryit be love in business we have colleagues and coworkers in the military they have brothers and sisters 12;when we be no longer able to change a situation we be challenge to change ourselves viktor frankl;we can define what we do but what we do should never define us;the purest way of help yourself be through service not only will the help come back around but the solutions you be search for will reveal themselves along the way;the bad news be we be our own worst enemies the good news be we be our own best hope;people tell me that s work more than anyone else be the perfect companion to my work so what a treat for me to talk to brené to further explore and debate well a whole lot of things listen at;three quarter of an answer be better than an answer and a half say more by say less;success be when our reality catch up to our imagination;sometimes we get so catch up strive for a perfect equilibrium that we forget to be present for the teeter find balance be about the journey not the destination it be about who come with us and what we experience along the way,Normal
302,it be better to go slow in the right direction than to go fast in the wrong direction;a leader without a title be better than a title without the ability to lead;integrity be when you say the same things publicly that you say privately;there be a common understand that in exchange for preferential treatment leaders be the first line of defense in the world of business however that social contract be breach when leaders sacrifice their people to preserve their own benefit and privilege;your work be your own private megaphone to tell the world what you believe;average leaders give people something to work on great leaders give people something to work for;there be a lack of good leadership in the world today we have create a culture in which leadership be focus on maximize profit regardless of the human cost;there be more opportunity in leave people want more than give them so much they wish they have less;the primary ingredient for progress be optimism the unwavering belief that something can be better be what drive the human race forward;our friends do not love us for what we do our friends love us for who we be;we do not always know where our leaders have be or what they have experience if they approach business with a mindset that be different from our own we must have empathy no matter our rank or position we can create a safe and supportive environment even for our leaders;leadership be not about be in charge leadership be about take care of those in your charge;new ideas need audiences like flower need be no matter how bright and colorful they will die unless others work to spread them;most of us live our live by accident we live as it happen fulfillment come when we live our live on purpose;in order to improve mental health in the workplace company and leaders must start to exercise more empathy toward their employees,Normal
303,give be sometimes as simple as say thank you to someone and mean it we should all give a little more;we do not just trust people to obey the rule we also trust that they know when to break them;leadership be not an expertise leadership be a constant education;whether you call it a vision mission or just because in order to be worthy of usage it must be these three things;leaders be not responsible for the result leaders be responsible for the people who be responsible for the result;failure we can do alone success always take help;there be people who care about us love us and will be there for us if we just let them;college be more than the class we take it be a massive opportunity for personal growth;when we give expect nothing in return it be remarkable how much more others will give back to us;a team be a group of people that work together with common purpose not just a group of people assign to work on the same project;we can learn about our future from our past because regardless of technology or the speed of innovation people be still people;communication be an indispensable asset especially for leaders unfortunately younger generations be grow up without the need to hone these abilities now company have no choice but to teach these vital interpersonal skills themselves;no matter how much money we make no matter how much power we accumulate no matter how many promotions we be give none of us will ever be declare the winner of life;let us all be the leaders we wish we have;love do not happen overnight we fall in love with someone when they show us consistently that they be will to put our need ahead of their own it be the small seemingly insignificant action that add up over time until one day we wake up and say i love you,Normal
304,money be like fuel cars need fuel but the purpose of the car be not to buy more fuel business be the same the purpose of business be not to make money it be to advance a greater purpose or because;before we can build the world we want to live in we have to imagine it greatness start with a clear vision of the future;weak leaders have the luxury of look after themselves great leaders have the honor of look after others;a mentor be not someone who walk ahead of us to show us how they do it a mentor walk alongside us to show us what we can do;profit be essential for businesses to thrive but it should never come at the cost of individuals or their livelihoods company must prioritize ethics and vision as much as profit before they permanently lose the trust of younger generations;we be only in charge when we be will to let others take charge;if you want to feel happy do something for yourself if you want to feel fulfil do something for someone else;be so good at figure out how to take a concept and make it practical for real life it be such a thrill to join her on her dare to lead podcast last week to talk aboue the principles from the infinite game listen exclusively on spotify;ambition be refuse to quit on ourselves leadership be refuse to quit on others;every day leaders have to deal with the selfish pressure of outside party to prioritize the short term over the long term it take unbelievable courage to choose the important over the urgent;the more people you inspire the more people will inspire you;we cannot be everything to everyone but we can be something to someoneeven a lot of someone be;any worthwhile conversation start with listen;when we give someone a safe space to share what they be go through personally or professionally we make them feel see hear and value;if you have the opportunity to do amaze things in your life bring someone with you,Normal
